<?xml version="1.0" encoding="UTF-8" standalone="yes"?><!DOCTYPE root [
<!ELEMENT root (resource+, path*, time_point*, time_profile*, routed_job*, job*, job_op*, setup_removal_table*, machine*, platform*, connection*)>
<!ELEMENT resource (id_resource, name, resource_type, info1*, info2*)>
<!ELEMENT id_resource (#PCDATA)>
<!ELEMENT resource_type (#PCDATA)>
<!ELEMENT info1 (#PCDATA)>
<!ELEMENT info2 (#PCDATA)>
<!ELEMENT name (#PCDATA)>
<!ELEMENT path (id_path, resource_list_elem+)>
<!ELEMENT resource_list_elem (id_resource)>
<!ELEMENT id_path (#PCDATA)>
<!ELEMENT time_point (id_time_point, processing_time*, perishability_time*,release_no_timeshift*, release_time*, due_date_no_timeshift*, due_date_time*, deadline_no_timeshift*, deadline_time*, weight_obj*, setup_time*, removal_time*, dependent_setup_type*, dependent_removal_type*, route_booking_forward*, route_booking_backward*)>
<!ELEMENT id_time_point (#PCDATA)>
<!ELEMENT processing_time (#PCDATA)>
<!ELEMENT perishability_time (#PCDATA)>
<!ELEMENT release_no_timeshift (#PCDATA)>
<!ELEMENT release_time (#PCDATA)>
<!ELEMENT due_date_no_timeshift (#PCDATA)>
<!ELEMENT due_date_time (#PCDATA)>
<!ELEMENT deadline_no_timeshift (#PCDATA)>
<!ELEMENT deadline_time (#PCDATA)>
<!ELEMENT weight_obj (#PCDATA)>
<!ELEMENT setup_time (#PCDATA)>
<!ELEMENT removal_time (#PCDATA)>
<!ELEMENT dependent_setup_type (#PCDATA)>
<!ELEMENT dependent_removal_type (#PCDATA)>
<!ELEMENT route_booking_forward (#PCDATA)>
<!ELEMENT route_booking_backward (#PCDATA)>
<!ELEMENT time_profile (id_time_profile, id_path, time_point_list_elem+)>
<!ELEMENT time_point_list_elem (id_time_point)>
<!ELEMENT id_time_profile (#PCDATA)>
<!ELEMENT routed_job (id_routed_job, job_type, time_shift, id_time_profile, weight_obj*)>
<!ELEMENT routed_job_list_elem (id_routed_job)>
<!ELEMENT job (id_job, name, routed_job_list_elem+, multiple_routings_list_elem+)>
<!ELEMENT multiple_routings_list_elem (id_resource, time_profile_list_elem+)>
<!ELEMENT time_profile_list_elem (id_time_profile)>
<!ELEMENT id_job (#PCDATA)>
<!ELEMENT id_routed_job (#PCDATA)>
<!ELEMENT job_type (#PCDATA)>
<!ELEMENT time_shift (#PCDATA)>
<!ELEMENT job_op (id_job, operation+)>
<!ELEMENT operation (id_resource, time_point)>
<!ELEMENT setup_removal_table (table_entry+)>
<!ELEMENT table_entry (dependent_type1, dependent_type2,  setup_removal_type, dependent_time)>
<!ELEMENT dependent_type1 (#PCDATA)>
<!ELEMENT dependent_type2 (#PCDATA)>
<!ELEMENT setup_removal_type (#PCDATA)>
<!ELEMENT dependent_time (#PCDATA)>
<!ELEMENT machine (resource_list_elem+)>
<!ELEMENT platform (resource_list_elem+)>
<!ELEMENT connection (id_job_from, id_resource_from, id_job_to, id_resource_to, connection_weight, connection_price, is_passenger)>
<!ELEMENT id_job_from (#PCDATA)>
<!ELEMENT id_resource_from (#PCDATA)>
<!ELEMENT id_job_to (#PCDATA)>
<!ELEMENT id_resource_to (#PCDATA)>
<!ELEMENT connection_weight (#PCDATA)>
<!ELEMENT connection_price (#PCDATA)>
<!ELEMENT is_passenger (#PCDATA)>]><root><resource><id_resource>82</id_resource><name>BIL_3#macchina#8226#332</name><resource_type>blocking</resource_type></resource><resource><id_resource>331</id_resource><name>SCAE-ZB_735#macchina#23621#330</name><resource_type>blocking</resource_type></resource><resource><id_resource>398</id_resource><name>ZB_6-A#macchina#5058#307</name><resource_type>blocking</resource_type></resource><resource><id_resource>1071</id_resource><name>WN_44</name><resource_type>blocking</resource_type></resource><resource><id_resource>845</id_resource><name>WN_43</name><resource_type>blocking</resource_type></resource><resource><id_resource>81</id_resource><name>BIL_3#macchina#8234#332</name><resource_type>blocking</resource_type></resource><resource><id_resource>573</id_resource><name>TW_83_GreatScott_FullPath</name><resource_type>blocking</resource_type></resource><resource><id_resource>217</id_resource><name>MELS_3#macchina#23425#152</name><resource_type>blocking</resource_type></resource><resource><id_resource>3</id_resource><name>ZWIE_2#macchina#18832#312</name><resource_type>blocking</resource_type></resource><resource><id_resource>358</id_resource><name>RUES_2#macchina#20430#232</name><resource_type>blocking</resource_type></resource><resource><id_resource>761</id_resource><name>TW_4#macchina#18827#504</name><resource_type>blocking</resource_type></resource><resource><id_resource>288</id_resource><name>SCAE-ZB_735#macchina#23621#335</name><resource_type>blocking</resource_type></resource><resource><id_resource>180</id_resource><name>RG_3#macchina#8224#362</name><resource_type>blocking</resource_type></resource><resource><id_resource>338</id_resource><name>SCAE-ZB_735#macchina#23621#340</name><resource_type>blocking</resource_type></resource><resource><id_resource>29</id_resource><name>SIB_3#macchina#8238#402</name><resource_type>blocking</resource_type></resource><resource><id_resource>372</id_resource><name>RI_1#macchina#18232#525</name><resource_type>blocking</resource_type></resource><resource><id_resource>664</id_resource><name>TW_5#macchina#20430#210</name><resource_type>blocking</resource_type></resource><resource><id_resource>436</id_resource><name>LQ_3#macchina#5060#67</name><resource_type>blocking</resource_type></resource><resource><id_resource>549</id_resource><name>LA_3#macchina#18230#430</name><resource_type>blocking</resource_type></resource><resource><id_resource>478</id_resource><name>RUES_1#macchina#18829#122</name><resource_type>blocking</resource_type></resource><resource><id_resource>692</id_resource><name>WAE_3#macchina#18827#237</name><resource_type>blocking</resource_type></resource><resource><id_resource>305</id_resource><name>SCAE-ZB_735#macchina#23621#345</name><resource_type>blocking</resource_type></resource><resource><id_resource>706</id_resource><name>HG_4#macchina#18231#187</name><resource_type>blocking</resource_type></resource><resource><id_resource>593</id_resource><name>ZB-NOU_557</name><resource_type>blocking</resource_type></resource><resource><id_resource>126</id_resource><name>KIL_1#macchina#18829#102</name><resource_type>blocking</resource_type></resource><resource><id_resource>469</id_resource><name>HG_3#macchina#18228#615</name><resource_type>blocking</resource_type></resource><resource><id_resource>154</id_resource><name>ZEN_2#macchina#18226#750</name><resource_type>blocking</resource_type></resource><resource><id_resource>496</id_resource><name>HGO_4_GreatScott_FullPath</name><resource_type>blocking</resource_type></resource><resource><id_resource>1038</id_resource><name>BRAG_23</name><resource_type>blocking</resource_type></resource><resource><id_resource>986</id_resource><name>BRAG_24</name><resource_type>blocking</resource_type></resource><resource><id_resource>314</id_resource><name>SCAE-ZB_735#macchina#23436#350</name><resource_type>blocking</resource_type></resource><resource><id_resource>1214</id_resource><name>ZG_83</name><resource_type>blocking</resource_type></resource><resource><id_resource>1694</id_resource><name>ZG_85</name><resource_type>blocking</resource_type></resource><resource><id_resource>150</id_resource><name>ZEN_2#macchina#18234#750</name><resource_type>blocking</resource_type></resource><resource><id_resource>412</id_resource><name>ZWIE_1#macchina#18823#37</name><resource_type>blocking</resource_type></resource><resource><id_resource>1691</id_resource><name>ZG_84</name><resource_type>blocking</resource_type></resource><resource><id_resource>1055</id_resource><name>FMS-WAL_112</name><resource_type>blocking</resource_type></resource><resource><id_resource>378</id_resource><name>RI_1#macchina#18224#525</name><resource_type>blocking</resource_type></resource><resource><id_resource>346</id_resource><name>HGO_94</name><resource_type>blocking</resource_type></resource><resource><id_resource>315</id_resource><name>SCAE-ZB_735#macchina#23630#345</name><resource_type>blocking</resource_type></resource><resource><id_resource>708</id_resource><name>LA_2#macchina#20531#282</name><resource_type>blocking</resource_type></resource><resource><id_resource>72</id_resource><name>BGH_2#macchina#19322#25</name><resource_type>blocking</resource_type></resource><resource><id_resource>463</id_resource><name>KIL_2#macchina#20430#247</name><resource_type>blocking</resource_type></resource><resource><id_resource>707</id_resource><name>LA_2#macchina#20523#282</name><resource_type>blocking</resource_type></resource><resource><id_resource>1407</id_resource><name>LITT_91</name><resource_type>blocking</resource_type></resource><resource><id_resource>655</id_resource><name>LITT_92</name><resource_type>blocking</resource_type></resource><resource><id_resource>337</id_resource><name>SCAE-ZB_735#macchina#23436#345</name><resource_type>blocking</resource_type></resource><resource><id_resource>299</id_resource><name>SCAE-ZB_735#macchina#23428#350</name><resource_type>blocking</resource_type></resource><resource><id_resource>1250</id_resource><name>ZEN_61</name><resource_type>blocking</resource_type></resource><resource><id_resource>883</id_resource><name>MELS-SA_201</name><resource_type>blocking</resource_type></resource><resource><id_resource>439</id_resource><name>LQ_3#macchina#560#67</name><resource_type>blocking</resource_type></resource><resource><id_resource>303</id_resource><name>SCAE-ZB_735#macchina#23436#340</name><resource_type>blocking</resource_type></resource><resource><id_resource>872</id_resource><name>FMS_84</name><resource_type>blocking</resource_type></resource><resource><id_resource>1054</id_resource><name>FMS_83</name><resource_type>blocking</resource_type></resource><resource><id_resource>289</id_resource><name>SCAE-ZB_735#macchina#23630#340</name><resource_type>blocking</resource_type></resource><resource><id_resource>222</id_resource><name>PF-FRBS_604#macchina#16928#40</name><resource_type>blocking</resource_type></resource><resource><id_resource>1315</id_resource><name>ZEN_62</name><resource_type>blocking</resource_type></resource><resource><id_resource>276</id_resource><name>SCAE-ZB_735#macchina#23621#325</name><resource_type>blocking</resource_type></resource><resource><id_resource>58</id_resource><name>SCBU_1#macchina#8236#382</name><resource_type>blocking</resource_type></resource><resource><id_resource>341</id_resource><name>SCAE-ZB_735#macchina#23630#335</name><resource_type>blocking</resource_type></resource><resource><id_resource>141</id_resource><name>BAA_1#macchina#20425#257</name><resource_type>blocking</resource_type></resource><resource><id_resource>330</id_resource><name>SCAE-ZB_735#macchina#23630#337</name><resource_type>blocking</resource_type></resource><resource><id_resource>770</id_resource><name>BIL_4#macchina#8225#442</name><resource_type>blocking</resource_type></resource><resource><id_resource>49</id_resource><name>BAA_3#macchina#20434#52</name><resource_type>blocking</resource_type></resource><resource><id_resource>174</id_resource><name>ZG_3#macchina#2408#12</name><resource_type>blocking</resource_type></resource><resource><id_resource>433</id_resource><name>RI_2#macchina#18829#262</name><resource_type>blocking</resource_type></resource><resource><id_resource>913</id_resource><name>ORD-HG_113</name><resource_type>blocking</resource_type></resource><resource><id_resource>280</id_resource><name>SCAE-ZB_735#macchina#23428#340</name><resource_type>blocking</resource_type></resource><resource><id_resource>432</id_resource><name>RI_2#macchina#18827#262</name><resource_type>blocking</resource_type></resource><resource><id_resource>238</id_resource><name>WAE_52#macchina#18830#112</name><resource_type>blocking</resource_type></resource><resource><id_resource>109</id_resource><name>MG_1#macchina#23425#237</name><resource_type>blocking</resource_type></resource><resource><id_resource>12</id_resource><name>ZWIE_2#macchina#18234#770</name><resource_type>blocking</resource_type></resource><resource><id_resource>278</id_resource><name>SCAE-ZB_735#macchina#23428#345</name><resource_type>blocking</resource_type></resource><resource><id_resource>417</id_resource><name>ZWIE_1#macchina#18225#37</name><resource_type>blocking</resource_type></resource><resource><id_resource>829</id_resource><name>RW_7</name><resource_type>blocking</resource_type></resource><resource><id_resource>306</id_resource><name>SCAE-ZB_735#macchina#23630#330</name><resource_type>blocking</resource_type></resource><resource><id_resource>516</id_resource><name>SIB_4#macchina#18231#370</name><resource_type>blocking</resource_type></resource><resource><id_resource>1330</id_resource><name>ZUE_T34-A</name><resource_type>blocking</resource_type></resource><resource><id_resource>1331</id_resource><name>ZUE_T34-B</name><resource_type>blocking</resource_type></resource><resource><id_resource>1241</id_resource><name>ZAU_11</name><resource_type>blocking</resource_type></resource><resource><id_resource>540</id_resource><name>HGO_73</name><resource_type>blocking</resource_type></resource><resource><id_resource>1324</id_resource><name>ZAU_12</name><resource_type>blocking</resource_type></resource><resource><id_resource>322</id_resource><name>SCAE-ZB_735#macchina#23630#325</name><resource_type>blocking</resource_type></resource><resource><id_resource>896</id_resource><name>ZAU_14</name><resource_type>blocking</resource_type></resource><resource><id_resource>1162</id_resource><name>ZAU_15</name><resource_type>blocking</resource_type></resource><resource><id_resource>63</id_resource><name>SCBU_1#macchina#8228#382</name><resource_type>blocking</resource_type></resource><resource><id_resource>132</id_resource><name>HGO_74</name><resource_type>blocking</resource_type></resource><resource><id_resource>867</id_resource><name>MOLS-WAL_214</name><resource_type>blocking</resource_type></resource><resource><id_resource>200</id_resource><name>SA_3#macchina#913#582</name><resource_type>blocking</resource_type></resource><resource><id_resource>646</id_resource><name>SA_5#macchina#23432#585</name><resource_type>blocking</resource_type></resource><resource><id_resource>408</id_resource><name>ZWIE_1#macchina#20425#37</name><resource_type>blocking</resource_type></resource><resource><id_resource>66</id_resource><name>BGH_2#macchina#19334#25</name><resource_type>blocking</resource_type></resource><resource><id_resource>265</id_resource><name>SCAE-ZB_735#macchina#23428#330</name><resource_type>blocking</resource_type></resource><resource><id_resource>437</id_resource><name>LQ_3#macchina#562#67</name><resource_type>blocking</resource_type></resource><resource><id_resource>559</id_resource><name>WAL_4#macchina#23429#197</name><resource_type>blocking</resource_type></resource><resource><id_resource>272</id_resource><name>SCAE-ZB_735#macchina#23428#335</name><resource_type>blocking</resource_type></resource><resource><id_resource>231</id_resource><name>WAE_52#macchina#18824#112</name><resource_type>blocking</resource_type></resource><resource><id_resource>318</id_resource><name>SCAE-ZB_735#macchina#23630#320</name><resource_type>blocking</resource_type></resource><resource><id_resource>1081</id_resource><name>BIL_73</name><resource_type>blocking</resource_type></resource><resource><id_resource>971</id_resource><name>BIL_74</name><resource_type>blocking</resource_type></resource><resource><id_resource>13</id_resource><name>ZWIE_2#macchina#20428#312</name><resource_type>blocking</resource_type></resource><resource><id_resource>236</id_resource><name>WAE_52#macchina#18232#555</name><resource_type>blocking</resource_type></resource><resource><id_resource>1052</id_resource><name>FMS_33</name><resource_type>blocking</resource_type></resource><resource><id_resource>326</id_resource><name>SCAE-ZB_735#macchina#23621#350</name><resource_type>blocking</resource_type></resource><resource><id_resource>389</id_resource><name>ALTD_2#macchina#18223#322</name><resource_type>blocking</resource_type></resource><resource><id_resource>91</id_resource><name>BAE_1#macchina#18825#277</name><resource_type>blocking</resource_type></resource><resource><id_resource>382</id_resource><name>LITT_62</name><resource_type>blocking</resource_type></resource><resource><id_resource>726</id_resource><name>AU_4#macchina#18825#212</name><resource_type>blocking</resource_type></resource><resource><id_resource>1408</id_resource><name>LITT_61</name><resource_type>blocking</resource_type></resource><resource><id_resource>467</id_resource><name>HG_3</name><resource_type>blocking</resource_type></resource><resource><id_resource>143</id_resource><name>BAA_1</name><resource_type>blocking</resource_type></resource><resource><id_resource>847</id_resource><name>WN-MH_227</name><resource_type>blocking</resource_type></resource><resource><id_resource>696</id_resource><name>HG_4</name><resource_type>blocking</resource_type></resource><resource><id_resource>848</id_resource><name>WN-MH_226</name><resource_type>blocking</resource_type></resource><resource><id_resource>48</id_resource><name>BAA_3</name><resource_type>blocking</resource_type></resource><resource><id_resource>846</id_resource><name>WN-MH_228</name><resource_type>blocking</resource_type></resource><resource><id_resource>1318</id_resource><name>ZEN_12</name><resource_type>blocking</resource_type></resource><resource><id_resource>1247</id_resource><name>ZEN_11</name><resource_type>blocking</resource_type></resource><resource><id_resource>235</id_resource><name>WAE_52#macchina#18226#555</name><resource_type>blocking</resource_type></resource><resource><id_resource>18</id_resource><name>ZWIE_2#macchina#20434#312</name><resource_type>blocking</resource_type></resource><resource><id_resource>204</id_resource><name>SA_3#macchina#5061#582</name><resource_type>blocking</resource_type></resource><resource><id_resource>676</id_resource><name>RG_4#macchina#8231#412</name><resource_type>blocking</resource_type></resource><resource><id_resource>687</id_resource><name>WAE_3#macchina#5063#182</name><resource_type>blocking</resource_type></resource><resource><id_resource>377</id_resource><name>RI_1#macchina#18234#525</name><resource_type>blocking</resource_type></resource><resource><id_resource>285</id_resource><name>SCAE-ZB_735</name><resource_type>blocking</resource_type></resource><resource><id_resource>7</id_resource><name>ZWIE_2#macchina#18228#770</name><resource_type>blocking</resource_type></resource><resource><id_resource>1129</id_resource><name>WAE-AU_223</name><resource_type>blocking</resource_type></resource><resource><id_resource>1130</id_resource><name>WAE-AU_222</name><resource_type>blocking</resource_type></resource><resource><id_resource>1131</id_resource><name>WAE-AU_221</name><resource_type>blocking</resource_type></resource><resource><id_resource>114</id_resource><name>FMS_4#macchina#23428#537</name><resource_type>blocking</resource_type></resource><resource><id_resource>117</id_resource><name>FMS_4#macchina#23428#535</name><resource_type>blocking</resource_type></resource><resource><id_resource>186</id_resource><name>RG_3#macchina#8230#362</name><resource_type>blocking</resource_type></resource><resource><id_resource>454</id_resource><name>KIL_2#macchina#20432#247</name><resource_type>blocking</resource_type></resource><resource><id_resource>1206</id_resource><name>BAAN_1</name><resource_type>blocking</resource_type></resource><resource><id_resource>1399</id_resource><name>BAAN_2</name><resource_type>blocking</resource_type></resource><resource><id_resource>815</id_resource><name>dummy</name><resource_type>blocking</resource_type></resource><resource><id_resource>1426</id_resource><name>TW_55</name><resource_type>blocking</resource_type></resource><resource><id_resource>47</id_resource><name>BAA_3#macchina#20424#52</name><resource_type>blocking</resource_type></resource><resource><id_resource>411</id_resource><name>ZWIE_1#macchina#18825#37</name><resource_type>blocking</resource_type></resource><resource><id_resource>1146</id_resource><name>TW_56</name><resource_type>blocking</resource_type></resource><resource><id_resource>267</id_resource><name>SCAE-ZB_735#macchina#23429#345</name><resource_type>blocking</resource_type></resource><resource><id_resource>651</id_resource><name>ORD_1#macchina#18830#182</name><resource_type>blocking</resource_type></resource><resource><id_resource>480</id_resource><name>RUES_1</name><resource_type>blocking</resource_type></resource><resource><id_resource>637</id_resource><name>ORDD_2#macchina#20429#162</name><resource_type>blocking</resource_type></resource><resource><id_resource>397</id_resource><name>ZB_6-A#macchina#5064#307</name><resource_type>blocking</resource_type></resource><resource><id_resource>513</id_resource><name>TW_3#macchina#18231#142</name><resource_type>blocking</resource_type></resource><resource><id_resource>116</id_resource><name>FMS_4#macchina#23436#535</name><resource_type>blocking</resource_type></resource><resource><id_resource>271</id_resource><name>SCAE-ZB_735#macchina#23429#340</name><resource_type>blocking</resource_type></resource><resource><id_resource>77</id_resource><name>BIL_3#macchina#8224#332</name><resource_type>blocking</resource_type></resource><resource><id_resource>120</id_resource><name>FMS_4#macchina#23436#537</name><resource_type>blocking</resource_type></resource><resource><id_resource>364</id_resource><name>RUES_2</name><resource_type>blocking</resource_type></resource><resource><id_resource>1229</id_resource><name>PF_66</name><resource_type>blocking</resource_type></resource><resource><id_resource>85</id_resource><name>BIL_3#macchina#8232#332</name><resource_type>blocking</resource_type></resource><resource><id_resource>876</id_resource><name>FMS_24</name><resource_type>blocking</resource_type></resource><resource><id_resource>97</id_resource><name>SBG_3#macchina#20430#407</name><resource_type>blocking</resource_type></resource><resource><id_resource>1338</id_resource><name>18827#1</name><resource_type>multiple_routings</resource_type></resource><resource><id_resource>69</id_resource><name>BGH_2#macchina#19324#25</name><resource_type>blocking</resource_type></resource><resource><id_resource>171</id_resource><name>BRAG_3#macchina#5058#102</name><resource_type>blocking</resource_type></resource><resource><id_resource>392</id_resource><name>ALTD_2#macchina#18233#322</name><resource_type>blocking</resource_type></resource><resource><id_resource>1153</id_resource><name>NIDB_N13</name><resource_type>blocking</resource_type></resource><resource><id_resource>830</id_resource><name>UZ_2</name><resource_type>blocking</resource_type></resource><resource><id_resource>1479</id_resource><name>UZ_3</name><resource_type>blocking</resource_type></resource><resource><id_resource>807</id_resource><name>TW_63</name><resource_type>blocking</resource_type></resource><resource><id_resource>1861</id_resource><name>20424#1</name><resource_type>multiple_routings</resource_type></resource><resource><id_resource>1190</id_resource><name>TW_64</name><resource_type>blocking</resource_type></resource><resource><id_resource>725</id_resource><name>AU_4#macchina#18823#212</name><resource_type>blocking</resource_type></resource><resource><id_resource>905</id_resource><name>NIDB_N12</name><resource_type>blocking</resource_type></resource><resource><id_resource>339</id_resource><name>SCAE-ZB_735#macchina#23429#335</name><resource_type>blocking</resource_type></resource><resource><id_resource>295</id_resource><name>SCAE-ZB_735#macchina#23429#330</name><resource_type>blocking</resource_type></resource><resource><id_resource>369</id_resource><name>RI_1#macchina#18226#525</name><resource_type>blocking</resource_type></resource><resource><id_resource>99</id_resource><name>SBG_3</name><resource_type>blocking</resource_type></resource><resource><id_resource>1177</id_resource><name>SBG_4</name><resource_type>blocking</resource_type></resource><resource><id_resource>1228</id_resource><name>PF_76</name><resource_type>blocking</resource_type></resource><resource><id_resource>1041</id_resource><name>SA_32</name><resource_type>blocking</resource_type></resource><resource><id_resource>115</id_resource><name>FMS_4#macchina#23440#537</name><resource_type>blocking</resource_type></resource><resource><id_resource>983</id_resource><name>SA_33</name><resource_type>blocking</resource_type></resource><resource><id_resource>823</id_resource><name>PF_79</name><resource_type>blocking</resource_type></resource><resource><id_resource>373</id_resource><name>RI_1#macchina#18230#525</name><resource_type>blocking</resource_type></resource><resource><id_resource>441</id_resource><name>LQ_3#macchina#912#67</name><resource_type>blocking</resource_type></resource><resource><id_resource>118</id_resource><name>FMS_4#macchina#23440#535</name><resource_type>blocking</resource_type></resource><resource><id_resource>27</id_resource><name>SIB_3#macchina#8228#402</name><resource_type>blocking</resource_type></resource><resource><id_resource>1149</id_resource><name>TW_26</name><resource_type>blocking</resource_type></resource><resource><id_resource>742</id_resource><name>ZG_5#macchina#2628#12</name><resource_type>blocking</resource_type></resource><resource><id_resource>610</id_resource><name>ZWOL_4#macchina#20431#72</name><resource_type>blocking</resource_type></resource><resource><id_resource>824</id_resource><name>PF_72</name><resource_type>blocking</resource_type></resource><resource><id_resource>820</id_resource><name>PF_73</name><resource_type>blocking</resource_type></resource><resource><id_resource>394</id_resource><name>ZB_6-A#macchina#23425#307</name><resource_type>blocking</resource_type></resource><resource><id_resource>821</id_resource><name>PF_74</name><resource_type>blocking</resource_type></resource><resource><id_resource>345</id_resource><name>FMS_3#macchina#23429#177</name><resource_type>blocking</resource_type></resource><resource><id_resource>822</id_resource><name>PF_75</name><resource_type>blocking</resource_type></resource><resource><id_resource>422</id_resource><name>LITT_11</name><resource_type>blocking</resource_type></resource><resource><id_resource>504</id_resource><name>TW_3</name><resource_type>blocking</resource_type></resource><resource><id_resource>313</id_resource><name>SCAE-ZB_735#macchina#23429#325</name><resource_type>blocking</resource_type></resource><resource><id_resource>804</id_resource><name>TW_33</name><resource_type>blocking</resource_type></resource><resource><id_resource>691</id_resource><name>WAE_3#macchina#18829#237</name><resource_type>blocking</resource_type></resource><resource><id_resource>31</id_resource><name>SIB_3#macchina#20528#402</name><resource_type>blocking</resource_type></resource><resource><id_resource>376</id_resource><name>RI_1#macchina#18828#87</name><resource_type>blocking</resource_type></resource><resource><id_resource>1108</id_resource><name>ALTD-PF_235</name><resource_type>blocking</resource_type></resource><resource><id_resource>415</id_resource><name>ZWIE_1#macchina#18223#37</name><resource_type>blocking</resource_type></resource><resource><id_resource>316</id_resource><name>SCAE-ZB_735#macchina#23429#320</name><resource_type>blocking</resource_type></resource><resource><id_resource>1107</id_resource><name>ALTD-PF_236</name><resource_type>blocking</resource_type></resource><resource><id_resource>677</id_resource><name>RG_4#macchina#8221#412</name><resource_type>blocking</resource_type></resource><resource><id_resource>615</id_resource><name>TW_6</name><resource_type>blocking</resource_type></resource><resource><id_resource>663</id_resource><name>TW_5</name><resource_type>blocking</resource_type></resource><resource><id_resource>759</id_resource><name>TW_4</name><resource_type>blocking</resource_type></resource><resource><id_resource>1120</id_resource><name>HAF-RI_228</name><resource_type>blocking</resource_type></resource><resource><id_resource>1396</id_resource><name>ZG_13</name><resource_type>blocking</resource_type></resource><resource><id_resource>828</id_resource><name>PF-RW_703</name><resource_type>blocking</resource_type></resource><resource><id_resource>148</id_resource><name>ZEN_2#macchina#18228#750</name><resource_type>blocking</resource_type></resource><resource><id_resource>797</id_resource><name>HGO-SBG_416</name><resource_type>blocking</resource_type></resource><resource><id_resource>131</id_resource><name>HGO_74_GreatScott_FullPath</name><resource_type>blocking</resource_type></resource><resource><id_resource>383</id_resource><name>HGO-SBG_418</name><resource_type>blocking</resource_type></resource><resource><id_resource>576</id_resource><name>HGO-SBG_417</name><resource_type>blocking</resource_type></resource><resource><id_resource>35</id_resource><name>SIB_3#macchina#20536#402</name><resource_type>blocking</resource_type></resource><resource><id_resource>1209</id_resource><name>ZG_18</name><resource_type>blocking</resource_type></resource><resource><id_resource>1109</id_resource><name>PF_83</name><resource_type>blocking</resource_type></resource><resource><id_resource>591</id_resource><name>HGO_3#macchina#20425#177</name><resource_type>blocking</resource_type></resource><resource><id_resource>413</id_resource><name>ZWIE_1#macchina#20423#37</name><resource_type>blocking</resource_type></resource><resource><id_resource>943</id_resource><name>PF_85</name><resource_type>blocking</resource_type></resource><resource><id_resource>904</id_resource><name>ZKOL-NIDB_157</name><resource_type>blocking</resource_type></resource><resource><id_resource>902</id_resource><name>ZKOL-NIDB_155</name><resource_type>blocking</resource_type></resource><resource><id_resource>1429</id_resource><name>TW_45</name><resource_type>blocking</resource_type></resource><resource><id_resource>903</id_resource><name>ZKOL-NIDB_156</name><resource_type>blocking</resource_type></resource><resource><id_resource>1148</id_resource><name>TW_46</name><resource_type>blocking</resource_type></resource><resource><id_resource>900</id_resource><name>ZKOL-NIDB_153</na